{
  "$schema": "https://json-schema.org/draft/2020-12/schema",
  "$id": "https://github.com/kaisleung/polyrig/schemas/feature_list.schema.json",
  "title": "PolyRig feature_list.json",
  "description": "Plan-as-state feature list generated into target projects (and used by the PolyRig repo itself). Each feature moves through the state machine planned -> in_progress -> (blocked) -> implemented -> verified, plus rejected. Hard rules: update after every implementation attempt; never set 'verified' unless verification commands passed or manual verification is explicitly documented.",
  "type": "object",
  "required": ["project", "version", "generated_at", "features"],
  "properties": {
    "$comment": {
      "type": "string",
      "description": "Free-form usage note carried inside the instance file."
    },
    "project": {
      "type": "string",
      "minLength": 1,
      "description": "Project name."
    },
    "version": {
      "type": "string",
      "minLength": 1,
      "description": "Version of the plan/project this feature list belongs to, e.g. '0.1.0'."
    },
    "generated_at": {
      "type": "string",
      "format": "date",
      "pattern": "^\\d{4}-\\d{2}-\\d{2}$",
      "description": "Date (YYYY-MM-DD) the feature list was generated."
    },
    "features": {
      "type": "array",
      "items": { "$ref": "#/$defs/feature" },
      "description": "The features, each carrying its own persistent state."
    }
  },
  "$defs": {
    "feature": {
      "type": "object",
      "required": ["id", "title", "status", "priority", "acceptance_criteria", "verification"],
      "properties": {
        "id": {
          "type": "string",
          "pattern": "^F\\d{3}$",
          "description": "Feature id, e.g. 'F001'."
        },
        "title": {
          "type": "string",
          "minLength": 1,
          "description": "Short human-readable feature title."
        },
        "status": {
          "type": "string",
          "enum": ["planned", "in_progress", "blocked", "implemented", "verified", "rejected"],
          "description": "Current state in the feature state machine: planned -> in_progress -> (blocked) -> implemented -> verified, plus rejected."
        },
        "priority": {
          "type": "string",
          "enum": ["p0", "p1", "p2"],
          "description": "Priority: p0 (must-have) to p2 (nice-to-have)."
        },
        "depends_on": {
          "type": "array",
          "default": [],
          "items": {
            "type": "string",
            "pattern": "^F\\d{3}$"
          },
          "uniqueItems": true,
          "description": "Ids of features that must reach at least 'implemented' before this one starts."
        },
        "pack_refs": {
          "type": "array",
          "default": [],
          "items": {
            "type": "string",
            "pattern": "^(stack|domain)/[a-z0-9-]+$"
          },
          "uniqueItems": true,
          "description": "Ids of packs whose knowledge this feature draws on (routes the agent to docs/stacks/<id>/ and docs/domains/<id>/)."
        },
        "acceptance_criteria": {
          "type": "array",
          "minItems": 1,
          "items": {
            "type": "string",
            "minLength": 1
          },
          "description": "Concrete, checkable criteria the implementation must satisfy."
        },
        "verification": {
          "type": "object",
          "required": ["manual", "automated"],
          "description": "Verification route for the feature. 'verified' status requires the automated commands to pass or the manual checks to be explicitly documented.",
          "properties": {
            "manual": {
              "type": "array",
              "items": { "type": "string" },
              "description": "Manual verification steps/checks."
            },
            "automated": {
              "type": "array",
              "items": { "type": "string" },
              "description": "Shell commands that must exit 0, e.g. './gradlew test'."
            }
          },
          "additionalProperties": false
        },
        "files_expected": {
          "type": "array",
          "default": [],
          "items": { "type": "string" },
          "description": "Repo-relative paths the implementation is expected to create or modify."
        },
        "notes": {
          "type": "string",
          "default": "",
          "description": "Free-form notes: blockers, manual-verification evidence, deviations."
        }
      },
      "additionalProperties": false
    }
  },
  "additionalProperties": false
}
